21:23:07.603941 IP 10.0.2.9.49420 > 10.0.2.15.ssh: Flags [S], seq 3629214710, win 64240, options [mss 1460,sackOK,TS val 3452922494 ecr 0,nop,wscale 6], length 0
21:23:07.603970 IP 10.0.2.15.ssh > 10.0.2.9.49420: Flags [S.], seq 2643117935, ack 3629214711, win 65160, options [mss 1460,sackOK,TS val 2004499114 ecr 3452922494,nop,wscale 6], length 0
21:23:07.604120 IP 10.0.2.9.49420 > 10.0.2.15.ssh: Flags [.], ack 1, win 1004, options [nop,nop,TS val 3452922495 ecr 2004499114], length 0
21:23:07.604380 IP 10.0.2.9.49420 > 10.0.2.15.ssh: Flags [P.], seq 1:42, ack 1, win 1004, options [nop,nop,TS val 3452922495 ecr 2004499114], length 41
21:23:07.604387 IP 10.0.2.15.ssh > 10.0.2.9.49420: Flags [.], ack 42, win 1018, options [nop,nop,TS val 2004499115 ecr 3452922495], length 0
21:23:07.608878 IP 10.0.2.15.ssh > 10.0.2.9.49420: Flags [P.], seq 1:42, ack 42, win 1018, options [nop,nop,TS val 2004499119 ecr 3452922495], length 41
21:23:07.609082 IP 10.0.2.9.49420 > 10.0.2.15.ssh: Flags [.], ack 42, win 1004, options [nop,nop,TS val 3452922500 ecr 2004499119], length 0
21:23:07.609386 IP 10.0.2.9.49420 > 10.0.2.15.ssh: Flags [P.], seq 42:1434, ack 42, win 1004, options [nop,nop,TS val 3452922500 ecr 2004499119], length 1392
21:23:07.609693 IP 10.0.2.15.ssh > 10.0.2.9.49420: Flags [P.], seq 42:1122, ack 1434, win 1002, options [nop,nop,TS val 2004499120 ecr 3452922500], length 1080
21:23:07.611936 IP 10.0.2.9.49420 > 10.0.2.15.ssh: Flags [P.], seq 1434:1482, ack 1122, win 1002, options [nop,nop,TS val 3452922503 ecr 2004499120], length 48
21:23:07.615957 IP 10.0.2.15.ssh > 10.0.2.9.49420: Flags [P.], seq 1122:1574, ack 1482, win 1002, options [nop,nop,TS val 2004499126 ecr 3452922503], length 452
21:23:07.618371 IP 10.0.2.9.49420 > 10.0.2.15.ssh: Flags [P.], seq 1482:1498, ack 1574, win 1002, options [nop,nop,TS val 3452922509 ecr 2004499126], length 16
21:23:07.661379 IP 10.0.2.15.ssh > 10.0.2.9.49420: Flags [.], ack 1498, win 1002, options [nop,nop,TS val 2004499172 ecr 3452922509], length 0
21:23:07.661555 IP 10.0.2.9.49420 > 10.0.2.15.ssh: Flags [P.], seq 1498:1542, ack 1574, win 1002, options [nop,nop,TS val 3452922552 ecr 2004499172], length 44
21:23:07.661564 IP 10.0.2.15.ssh > 10.0.2.9.49420: Flags [.], ack 1542, win 1002, options [nop,nop,TS val 2004499172 ecr 3452922552], length 0
21:23:07.661623 IP 10.0.2.15.ssh > 10.0.2.9.49420: Flags [P.], seq 1574:1618, ack 1542, win 1002, options [nop,nop,TS val 2004499172 ecr 3452922552], length 44
21:23:07.661762 IP 10.0.2.9.49420 > 10.0.2.15.ssh: Flags [P.], seq 1542:1610, ack 1618, win 1002, options [nop,nop,TS val 3452922552 ecr 2004499172], length 68
21:23:07.669176 IP 10.0.2.15.ssh > 10.0.2.9.49420: Flags [P.], seq 1618:1670, ack 1610, win 1002, options [nop,nop,TS val 2004499179 ecr 3452922552], length 52
21:23:07.712260 IP 10.0.2.9.49420 > 10.0.2.15.ssh: Flags [.], ack 1670, win 1002, options [nop,nop,TS val 3452922603 ecr 2004499179], length 0
21:23:09.727979 IP 10.0.2.9.49420 > 10.0.2.15.ssh: Flags [P.], seq 1610:1694, ack 1670, win 1002, options [nop,nop,TS val 3452924618 ecr 2004499179], length 84
21:23:09.735295 IP 10.0.2.15.ssh > 10.0.2.9.49420: Flags [P.], seq 1670:1698, ack 1694, win 1002, options [nop,nop,TS val 2004501246 ecr 3452924618], length 28
21:23:09.735452 IP 10.0.2.9.49420 > 10.0.2.15.ssh: Flags [.], ack 1698, win 1002, options [nop,nop,TS val 3452924626 ecr 2004501246], length 0
21:23:09.735538 IP 10.0.2.9.49420 > 10.0.2.15.ssh: Flags [P.], seq 1694:1806, ack 1698, win 1002, options [nop,nop,TS val 3452924626 ecr 2004501246], length 112
21:23:09.777145 IP 10.0.2.15.ssh > 10.0.2.9.49420: Flags [.], ack 1806, win 1002, options [nop,nop,TS val 2004501287 ecr 3452924626], length 0
21:23:09.786852 IP 10.0.2.15.ssh > 10.0.2.9.49420: Flags [P.], seq 1698:2198, ack 1806, win 1002, options [nop,nop,TS val 2004501297 ecr 3452924626], length 500
21:23:09.828036 IP 10.0.2.9.49420 > 10.0.2.15.ssh: Flags [.], ack 2198, win 1002, options [nop,nop,TS val 3452924719 ecr 2004501297], length 0
21:23:09.828049 IP 10.0.2.15.ssh > 10.0.2.9.49420: Flags [P.], seq 2198:2242, ack 1806, win 1002, options [nop,nop,TS val 2004501338 ecr 3452924719], length 44
21:23:09.828204 IP 10.0.2.9.49420 > 10.0.2.15.ssh: Flags [.], ack 2242, win 1002, options [nop,nop,TS val 3452924719 ecr 2004501338], length 0
21:23:09.828298 IP 10.0.2.9.49420 > 10.0.2.15.ssh: Flags [P.], seq 1806:1910, ack 2242, win 1002, options [nop,nop,TS val 3452924719 ecr 2004501338], length 104
21:23:09.828304 IP 10.0.2.15.ssh > 10.0.2.9.49420: Flags [.], ack 1910, win 1002, options [nop,nop,TS val 2004501339 ecr 3452924719], length 0
21:23:09.828622 IP 10.0.2.15.ssh > 10.0.2.9.49420: Flags [P.], seq 2242:2314, ack 1910, win 1002, options [nop,nop,TS val 2004501339 ecr 3452924719], length 72
21:23:09.828755 IP 10.0.2.9.49420 > 10.0.2.15.ssh: Flags [P.], seq 1910:1954, ack 2314, win 1002, options [nop,nop,TS val 3452924719 ecr 2004501339], length 44
21:23:09.829061 IP 10.0.2.15.ssh > 10.0.2.9.49420: Flags [P.], seq 2314:2502, ack 1954, win 1002, options [nop,nop,TS val 2004501339 ecr 3452924719], length 188
21:23:09.829470 IP 10.0.2.9.49420 > 10.0.2.15.ssh: Flags [P.], seq 1954:2006, ack 2502, win 1002, options [nop,nop,TS val 3452924720 ecr 2004501339], length 52
21:23:09.829523 IP 10.0.2.15.ssh > 10.0.2.9.49420: Flags [P.], seq 2502:2578, ack 2006, win 1002, options [nop,nop,TS val 2004501340 ecr 3452924720], length 76
21:23:09.872070 IP 10.0.2.9.49420 > 10.0.2.15.ssh: Flags [.], ack 2578, win 1002, options [nop,nop,TS val 3452924763 ecr 2004501340], length 0
21:23:24.474142 IP 10.0.2.9.49420 > 10.0.2.15.ssh: Flags [P.], seq 2006:2066, ack 2578, win 1002, options [nop,nop,TS val 3452939365 ecr 2004501340], length 60
21:23:24.474283 IP 10.0.2.15.ssh > 10.0.2.9.49420: Flags [P.], seq 2578:2646, ack 2066, win 1002, options [nop,nop,TS val 2004515984 ecr 3452939365], length 68
21:23:24.474450 IP 10.0.2.9.49420 > 10.0.2.15.ssh: Flags [.], ack 2646, win 1002, options [nop,nop,TS val 3452939365 ecr 2004515984], length 0
21:23:24.474486 IP 10.0.2.9.49420 > 10.0.2.15.ssh: Flags [P.], seq 2066:2118, ack 2646, win 1002, options [nop,nop,TS val 3452939365 ecr 2004515984], length 52
21:23:24.474588 IP 10.0.2.15.ssh > 10.0.2.9.49420: Flags [P.], seq 2646:2722, ack 2118, win 1002, options [nop,nop,TS val 2004515985 ecr 3452939365], length 76
21:23:24.516932 IP 10.0.2.9.49420 > 10.0.2.15.ssh: Flags [.], ack 2722, win 1002, options [nop,nop,TS val 3452939407 ecr 2004515985], length 0
21:23:27.850625 IP 10.0.2.9.49420 > 10.0.2.15.ssh: Flags [P.], seq 2118:2170, ack 2722, win 1002, options [nop,nop,TS val 3452942741 ecr 2004515985], length 52
21:23:27.850770 IP 10.0.2.15.ssh > 10.0.2.9.49420: Flags [P.], seq 2722:2774, ack 2170, win 1002, options [nop,nop,TS val 2004519361 ecr 3452942741], length 52
21:23:27.850990 IP 10.0.2.9.49420 > 10.0.2.15.ssh: Flags [.], ack 2774, win 1002, options [nop,nop,TS val 3452942742 ecr 2004519361], length 0
21:23:27.851164 IP 10.0.2.9.49420 > 10.0.2.15.ssh: Flags [P.], seq 2170:2222, ack 2774, win 1002, options [nop,nop,TS val 3452942742 ecr 2004519361], length 52
21:23:27.851364 IP 10.0.2.15.ssh > 10.0.2.9.49420: Flags [P.], seq 2774:3706, ack 2222, win 1002, options [nop,nop,TS val 2004519362 ecr 3452942742], length 932
21:23:27.851566 IP 10.0.2.9.49420 > 10.0.2.15.ssh: Flags [P.], seq 2222:2274, ack 3706, win 1002, options [nop,nop,TS val 3452942742 ecr 2004519362], length 52
21:23:27.851611 IP 10.0.2.15.ssh > 10.0.2.9.49420: Flags [P.], seq 3706:3774, ack 2274, win 1002, options [nop,nop,TS val 2004519362 ecr 3452942742], length 68
21:23:27.851754 IP 10.0.2.9.49420 > 10.0.2.15.ssh: Flags [P.], seq 2274:2326, ack 3774, win 1002, options [nop,nop,TS val 3452942742 ecr 2004519362], length 52
21:23:27.851798 IP 10.0.2.15.ssh > 10.0.2.9.49420: Flags [P.], seq 3774:3842, ack 2326, win 1002, options [nop,nop,TS val 2004519362 ecr 3452942742], length 68
21:23:27.892292 IP 10.0.2.9.49420 > 10.0.2.15.ssh: Flags [.], ack 3842, win 1002, options [nop,nop,TS val 3452942783 ecr 2004519362], length 0
21:23:35.819680 IP 10.0.2.9.49420 > 10.0.2.15.ssh: Flags [P.], seq 2326:2378, ack 3842, win 1002, options [nop,nop,TS val 3452950710 ecr 2004519362], length 52
21:23:35.819779 IP 10.0.2.15.ssh > 10.0.2.9.49420: Flags [P.], seq 3842:3894, ack 2378, win 1002, options [nop,nop,TS val 2004527330 ecr 3452950710], length 52
21:23:35.819941 IP 10.0.2.9.49420 > 10.0.2.15.ssh: Flags [.], ack 3894, win 1002, options [nop,nop,TS val 3452950711 ecr 2004527330], length 0
21:23:35.820029 IP 10.0.2.9.49420 > 10.0.2.15.ssh: Flags [P.], seq 2378:2430, ack 3894, win 1002, options [nop,nop,TS val 3452950711 ecr 2004527330], length 52
21:23:35.820126 IP 10.0.2.15.ssh > 10.0.2.9.49420: Flags [P.], seq 3894:4826, ack 2430, win 1002, options [nop,nop,TS val 2004527330 ecr 3452950711], length 932
21:23:35.820338 IP 10.0.2.9.49420 > 10.0.2.15.ssh: Flags [P.], seq 2430:2482, ack 4826, win 1002, options [nop,nop,TS val 3452950711 ecr 2004527330], length 52
21:23:35.820379 IP 10.0.2.15.ssh > 10.0.2.9.49420: Flags [P.], seq 4826:4894, ack 2482, win 1002, options [nop,nop,TS val 2004527331 ecr 3452950711], length 68
21:23:35.820527 IP 10.0.2.9.49420 > 10.0.2.15.ssh: Flags [P.], seq 2482:2534, ack 4894, win 1002, options [nop,nop,TS val 3452950711 ecr 2004527331], length 52
21:23:35.820571 IP 10.0.2.15.ssh > 10.0.2.9.49420: Flags [P.], seq 4894:4962, ack 2534, win 1002, options [nop,nop,TS val 2004527331 ecr 3452950711], length 68
21:23:35.820707 IP 10.0.2.9.49420 > 10.0.2.15.ssh: Flags [P.], seq 2534:2594, ack 4962, win 1002, options [nop,nop,TS val 3452950711 ecr 2004527331], length 60
21:23:35.820750 IP 10.0.2.15.ssh > 10.0.2.9.49420: Flags [P.], seq 4962:5038, ack 2594, win 1002, options [nop,nop,TS val 2004527331 ecr 3452950711], length 76
21:23:35.864335 IP 10.0.2.9.49420 > 10.0.2.15.ssh: Flags [.], ack 5038, win 1002, options [nop,nop,TS val 3452950755 ecr 2004527331], length 0
21:23:36.307712 IP 10.0.2.9.49420 > 10.0.2.15.ssh: Flags [P.], seq 2594:2654, ack 5038, win 1002, options [nop,nop,TS val 3452951198 ecr 2004527331], length 60
21:23:36.307838 IP 10.0.2.15.ssh > 10.0.2.9.49420: Flags [P.], seq 5038:5114, ack 2654, win 1002, options [nop,nop,TS val 2004527818 ecr 3452951198], length 76
21:23:36.307970 IP 10.0.2.9.49420 > 10.0.2.15.ssh: Flags [.], ack 5114, win 1002, options [nop,nop,TS val 3452951199 ecr 2004527818], length 0
21:23:36.308034 IP 10.0.2.9.49420 > 10.0.2.15.ssh: Flags [P.], seq 2654:2714, ack 5114, win 1002, options [nop,nop,TS val 3452951199 ecr 2004527818], length 60
21:23:36.308108 IP 10.0.2.15.ssh > 10.0.2.9.49420: Flags [P.], seq 5114:5190, ack 2714, win 1002, options [nop,nop,TS val 2004527818 ecr 3452951199], length 76
21:23:36.352801 IP 10.0.2.9.49420 > 10.0.2.15.ssh: Flags [.], ack 5190, win 1002, options [nop,nop,TS val 3452951243 ecr 2004527818], length 0
21:23:37.478138 IP 10.0.2.9.49420 > 10.0.2.15.ssh: Flags [P.], seq 2714:2774, ack 5190, win 1002, options [nop,nop,TS val 3452952369 ecr 2004527818], length 60
21:23:37.478270 IP 10.0.2.15.ssh > 10.0.2.9.49420: Flags [P.], seq 5190:5242, ack 2774, win 1002, options [nop,nop,TS val 2004528988 ecr 3452952369], length 52
21:23:37.478464 IP 10.0.2.9.49420 > 10.0.2.15.ssh: Flags [.], ack 5242, win 1002, options [nop,nop,TS val 3452952369 ecr 2004528988], length 0
21:23:37.478585 IP 10.0.2.9.49420 > 10.0.2.15.ssh: Flags [P.], seq 2774:2826, ack 5242, win 1002, options [nop,nop,TS val 3452952369 ecr 2004528988], length 52
21:23:37.478697 IP 10.0.2.15.ssh > 10.0.2.9.49420: Flags [P.], seq 5242:5606, ack 2826, win 1002, options [nop,nop,TS val 2004528989 ecr 3452952369], length 364
21:23:37.478842 IP 10.0.2.9.49420 > 10.0.2.15.ssh: Flags [P.], seq 2826:2878, ack 5606, win 1002, options [nop,nop,TS val 3452952369 ecr 2004528989], length 52
21:23:37.478885 IP 10.0.2.15.ssh > 10.0.2.9.49420: Flags [P.], seq 5606:5674, ack 2878, win 1002, options [nop,nop,TS val 2004528989 ecr 3452952369], length 68
21:23:37.479017 IP 10.0.2.9.49420 > 10.0.2.15.ssh: Flags [P.], seq 2878:2930, ack 5674, win 1002, options [nop,nop,TS val 3452952370 ecr 2004528989], length 52
21:23:37.479060 IP 10.0.2.15.ssh > 10.0.2.9.49420: Flags [P.], seq 5674:5742, ack 2930, win 1002, options [nop,nop,TS val 2004528989 ecr 3452952370], length 68
21:23:37.520893 IP 10.0.2.9.49420 > 10.0.2.15.ssh: Flags [.], ack 5742, win 1002, options [nop,nop,TS val 3452952411 ecr 2004528989], length 0
21:23:45.036867 IP 10.0.2.9.49420 > 10.0.2.15.ssh: Flags [P.], seq 2930:2990, ack 5742, win 1002, options [nop,nop,TS val 3452959927 ecr 2004528989], length 60
21:23:45.036994 IP 10.0.2.15.ssh > 10.0.2.9.49420: Flags [P.], seq 5742:5794, ack 2990, win 1002, options [nop,nop,TS val 2004536547 ecr 3452959927], length 52
21:23:45.037154 IP 10.0.2.9.49420 > 10.0.2.15.ssh: Flags [.], ack 5794, win 1002, options [nop,nop,TS val 3452959928 ecr 2004536547], length 0
21:23:45.037218 IP 10.0.2.9.49420 > 10.0.2.15.ssh: Flags [P.], seq 2990:3042, ack 5794, win 1002, options [nop,nop,TS val 3452959928 ecr 2004536547], length 52
21:23:45.037387 IP 10.0.2.15.ssh > 10.0.2.9.49420: Flags [P.], seq 5794:6158, ack 3042, win 1002, options [nop,nop,TS val 2004536548 ecr 3452959928], length 364
21:23:45.037556 IP 10.0.2.9.49420 > 10.0.2.15.ssh: Flags [P.], seq 3042:3094, ack 6158, win 1002, options [nop,nop,TS val 3452959928 ecr 2004536548], length 52
21:23:45.037605 IP 10.0.2.15.ssh > 10.0.2.9.49420: Flags [P.], seq 6158:6226, ack 3094, win 1002, options [nop,nop,TS val 2004536548 ecr 3452959928], length 68
21:23:45.037738 IP 10.0.2.9.49420 > 10.0.2.15.ssh: Flags [P.], seq 3094:3146, ack 6226, win 1002, options [nop,nop,TS val 3452959928 ecr 2004536548], length 52
21:23:45.037794 IP 10.0.2.15.ssh > 10.0.2.9.49420: Flags [P.], seq 6226:6294, ack 3146, win 1002, options [nop,nop,TS val 2004536548 ecr 3452959928], length 68
21:23:45.037951 IP 10.0.2.9.49420 > 10.0.2.15.ssh: Flags [P.], seq 3146:3214, ack 6294, win 1002, options [nop,nop,TS val 3452959929 ecr 2004536548], length 68
21:23:45.037996 IP 10.0.2.15.ssh > 10.0.2.9.49420: Flags [P.], seq 6294:6370, ack 3214, win 1002, options [nop,nop,TS val 2004536548 ecr 3452959929], length 76
21:23:45.080885 IP 10.0.2.9.49420 > 10.0.2.15.ssh: Flags [.], ack 6370, win 1002, options [nop,nop,TS val 3452959971 ecr 2004536548], length 0
21:23:46.357115 IP 10.0.2.9.49420 > 10.0.2.15.ssh: Flags [P.], seq 3214:3282, ack 6370, win 1002, options [nop,nop,TS val 3452961248 ecr 2004536548], length 68
21:23:46.357223 IP 10.0.2.15.ssh > 10.0.2.9.49420: Flags [P.], seq 6370:6446, ack 3282, win 1002, options [nop,nop,TS val 2004537867 ecr 3452961248], length 76
21:23:46.357384 IP 10.0.2.9.49420 > 10.0.2.15.ssh: Flags [.], ack 6446, win 1002, options [nop,nop,TS val 3452961248 ecr 2004537867], length 0
21:23:46.357468 IP 10.0.2.9.49420 > 10.0.2.15.ssh: Flags [P.], seq 3282:3350, ack 6446, win 1002, options [nop,nop,TS val 3452961248 ecr 2004537867], length 68
21:23:46.357545 IP 10.0.2.15.ssh > 10.0.2.9.49420: Flags [P.], seq 6446:6522, ack 3350, win 1002, options [nop,nop,TS val 2004537868 ecr 3452961248], length 76
21:23:46.357806 IP 10.0.2.9.49420 > 10.0.2.15.ssh: Flags [P.], seq 3350:3426, ack 6522, win 1002, options [nop,nop,TS val 3452961248 ecr 2004537868], length 76
21:23:46.357885 IP 10.0.2.15.ssh > 10.0.2.9.49420: Flags [P.], seq 6522:6574, ack 3426, win 1002, options [nop,nop,TS val 2004537868 ecr 3452961248], length 52
21:23:46.358155 IP 10.0.2.9.49420 > 10.0.2.15.ssh: Flags [P.], seq 3426:3494, ack 6574, win 1002, options [nop,nop,TS val 3452961249 ecr 2004537868], length 68
21:23:46.358250 IP 10.0.2.15.ssh > 10.0.2.9.49420: Flags [P.], seq 6574:6730, ack 3494, win 1002, options [nop,nop,TS val 2004537868 ecr 3452961249], length 156
21:23:46.358417 IP 10.0.2.9.49420 > 10.0.2.15.ssh: Flags [P.], seq 3494:3562, ack 6730, win 1002, options [nop,nop,TS val 3452961249 ecr 2004537868], length 68
21:23:46.358484 IP 10.0.2.15.ssh > 10.0.2.9.49420: Flags [P.], seq 6730:6798, ack 3562, win 1002, options [nop,nop,TS val 2004537869 ecr 3452961249], length 68
21:23:46.358677 IP 10.0.2.9.49420 > 10.0.2.15.ssh: Flags [P.], seq 3562:3614, ack 6798, win 1002, options [nop,nop,TS val 3452961249 ecr 2004537869], length 52
21:23:46.358726 IP 10.0.2.15.ssh > 10.0.2.9.49420: Flags [P.], seq 6798:6866, ack 3614, win 1002, options [nop,nop,TS val 2004537869 ecr 3452961249], length 68
21:23:46.400689 IP 10.0.2.9.49420 > 10.0.2.15.ssh: Flags [.], ack 6866, win 1002, options [nop,nop,TS val 3452961291 ecr 2004537869], length 0
21:23:49.861554 IP 10.0.2.9.49420 > 10.0.2.15.ssh: Flags [P.], seq 3614:3650, ack 6866, win 1002, options [nop,nop,TS val 3452964752 ecr 2004537869], length 36
21:23:49.861917 IP 10.0.2.15.ssh > 10.0.2.9.49420: Flags [P.], seq 6866:6990, ack 3650, win 1002, options [nop,nop,TS val 2004541372 ecr 3452964752], length 124
21:23:49.862050 IP 10.0.2.9.49420 > 10.0.2.15.ssh: Flags [.], ack 6990, win 1002, options [nop,nop,TS val 3452964753 ecr 2004541372], length 0
21:23:49.862107 IP 10.0.2.9.49420 > 10.0.2.15.ssh: Flags [P.], seq 3650:3686, ack 6990, win 1002, options [nop,nop,TS val 3452964753 ecr 2004541372], length 36
21:23:49.862147 IP 10.0.2.9.49420 > 10.0.2.15.ssh: Flags [P.], seq 3686:3746, ack 6990, win 1002, options [nop,nop,TS val 3452964753 ecr 2004541372], length 60
21:23:49.862150 IP 10.0.2.9.49420 > 10.0.2.15.ssh: Flags [F.], seq 3746, ack 6990, win 1002, options [nop,nop,TS val 3452964753 ecr 2004541372], length 0
21:23:49.862180 IP 10.0.2.15.ssh > 10.0.2.9.49420: Flags [.], ack 3747, win 1002, options [nop,nop,TS val 2004541372 ecr 3452964753], length 0
21:23:49.864157 IP 10.0.2.15.ssh > 10.0.2.9.49420: Flags [F.], seq 6990, ack 3747, win 1002, options [nop,nop,TS val 2004541374 ecr 3452964753], length 0
21:23:49.864357 IP 10.0.2.9.49420 > 10.0.2.15.ssh: Flags [.], ack 6991, win 1002, options [nop,nop,TS val 3452964755 ecr 2004541374], length 0
